{"version":1,"plan_hash_version":1,"plan_sha256":"sha256:0123456789abcdef0123456789abcdef0123456789abcdef0123456789abcdef","operations":[{"operation_index":0,"selected_byte_length":5,"selected_logical_line_count":2},{"operation_index":3,"selected_byte_length":7,"selected_logical_line_count":1}],"outputs":[{"output_index":0,"before_logical_line_count":3,"after_logical_line_count":5,"insertion_groups_in_output_order":[{"destination_offset":2,"operation_indices":[0,3]}]},{"output_index":1,"before_logical_line_count":null,"after_logical_line_count":0,"insertion_groups_in_output_order":[]}]}
